{
  "version": "1.0",
  "task_id": "task_8561c3a3",
  "status": "success",
  "started_at": "2025-12-22T21:32:53.230409",
  "finished_at": "2025-12-22T21:32:53.232703",
  "summary": {
    "what_happened": "Task Execution Complete",
    "key_outputs": [],
    "next_actions": []
  },
  "artifacts": [],
  "audit": {
    "tool_calls": [],
    "warnings": [],
    "policy_violations": []
  }
}