{
  "version": "1.0",
  "task_id": "task_c7c6d800",
  "status": "success",
  "started_at": "2025-12-22T21:35:49.388336",
  "finished_at": "2025-12-22T21:35:50.300534",
  "summary": {
    "what_happened": "Executed 1 steps.",
    "key_outputs": [],
    "next_actions": []
  },
  "artifacts": [],
  "audit": {
    "tool_calls": [],
    "warnings": [],
    "policy_violations": []
  }
}