{
  "version": "1.0",
  "task_id": "task_chat_20251222_233422",
  "status": "success",
  "started_at": "2025-12-22T23:35:21.445779",
  "finished_at": "2025-12-22T23:35:22.041760",
  "summary": {
    "what_happened": "Task Execution Complete",
    "key_outputs": [],
    "next_actions": []
  },
  "artifacts": [],
  "audit": {
    "tool_calls": [],
    "warnings": [],
    "policy_violations": []
  }
}