{
  "version": "1.0",
  "task_id": "task_automation_test_003",
  "status": "success",
  "started_at": "2025-12-22T21:42:18.282246",
  "finished_at": "2025-12-22T21:42:19.250019",
  "summary": {
    "what_happened": "Task Execution Complete",
    "key_outputs": [],
    "next_actions": []
  },
  "artifacts": [],
  "audit": {
    "tool_calls": [],
    "warnings": [],
    "policy_violations": []
  }
}